{
  "schema_version": "1.0.0",
  "generated_at": "2026-05-04T21:00:00Z",
  "entry_count": 18,
  "privacy_policy": "All entries use public URLs only. No individual wallet balances, private task content, or de-anonymization data. Project-scoped artifacts use sanitized placeholders.",
  "entries": [
    {
      "id": "ART-01",
      "asset_name": "Guardrail Replay Pack",
      "lane": "agent_reliability",
      "artifact_type": "test_fixtures",
      "public_url": "https://gist.github.com/0xzoz/503e9b2cc787bbf7ee5c6534002ca258",
      "status": "shipped",
      "maintainer_category": "community_contributor",
      "reuse_instructions": "Clone the gist. Run `pytest test_guardrails.py` to execute all 59 tests. Add new fixtures to cases.json following the existing schema. Each fixture needs: id, name, category, input, expected.",
      "suggested_reproduction_task": "Run the 59 tests locally and verify all pass. Add 3 new fixtures covering a category not yet tested (e.g., rate limiting, auth boundary).",
      "duplicate_risk_notes": "Do NOT rebuild RAG reliability or prompt-injection fixtures from scratch. Extend this pack instead. Check for overlap with scope-regression-fixtures.",
      "evidence_standard": "pytest_pass_count + fixture_schema_validation"
    },
    {
      "id": "ART-02",
      "asset_name": "Off-Grid Scope Regression Fixtures",
      "lane": "task_generation_quality",
      "artifact_type": "test_fixtures",
      "public_url": "https://github.com/P-U-C/pft-validator/tree/main/alpha/scope-regression-fixtures",
      "status": "shipped",
      "maintainer_category": "community_contributor",
      "reuse_instructions": "Import fixtures.json into any classifier test harness. Use expected-results.json for quick pass/fail. Validate new fixtures against fixtures.schema.json. See README for decision tree and consumption patterns.",
      "suggested_reproduction_task": "Build a classifier function that passes all 20 fixtures. Report accuracy on boundary pairs specifically.",
      "duplicate_risk_notes": "Covers: deprecated, duplicate, stale, off-grid, adversarial, policy_violation, unverifiable. Do NOT create separate 'task quality' fixtures without checking overlap here first.",
      "evidence_standard": "json_schema_validation + classifier_accuracy_on_boundary_pairs"
    },
    {
      "id": "ART-03",
      "asset_name": "Alpha Brief Schema",
      "lane": "market_intelligence",
      "artifact_type": "json_schema",
      "public_url": "https://github.com/P-U-C/pft-validator/tree/main/alpha/alpha-brief-schema",
      "status": "shipped",
      "maintainer_category": "community_contributor",
      "reuse_instructions": "Use the schema to structure new alpha briefs. Four brief types supported: event_trade, structural_thesis, strategy_observation, intelligence_signal. Include machine_checks and agent_actionability_path for each brief.",
      "suggested_reproduction_task": "Write a new alpha brief using the schema for a current market event. Validate against the JSON schema and include all required fields.",
      "duplicate_risk_notes": "Do NOT create a new 'alpha format' or 'trade thesis template' without referencing this schema. Extend the brief_type enum if needed.",
      "evidence_standard": "schema_validation + two_filled_examples"
    },
    {
      "id": "ART-04",
      "asset_name": "LLM Convergence Scanner",
      "lane": "alpha_tooling",
      "artifact_type": "dashboard_and_pipeline",
      "public_url": "https://pft.permanentupperclass.com/scanner/",
      "status": "live",
      "maintainer_category": "community_contributor",
      "reuse_instructions": "Dashboard consumes scan-results.json. To add tickers: edit the THEMES dict in run_live_scan.py. Scoring formula: convergence × (1/IV) × log(liquidity). Requires IBKR Gateway for live data or Yahoo Finance fallback.",
      "suggested_reproduction_task": "Run the scanner against 5 new tickers not in the current theme list. Verify scoring output matches expected formula. Report any data gaps.",
      "duplicate_risk_notes": "Do NOT build a separate 'options screener' or 'LLM stock picker'. Extend this scanner's theme list and scoring weights instead.",
      "evidence_standard": "scan_output_json + scoring_formula_verification"
    },
    {
      "id": "ART-05",
      "asset_name": "Network Intelligence Dashboard (Lens)",
      "lane": "network_analytics",
      "artifact_type": "dashboard",
      "public_url": "https://pft.permanentupperclass.com/lens/",
      "status": "live",
      "maintainer_category": "community_contributor",
      "reuse_instructions": "Consumes graph.json, audit.json, health.json, subs.json from the pft-validator repo. Data exported via cron scripts in pf-scout-bot/deploy/. To add a new data panel: add export logic to the relevant export script, update the dashboard HTML.",
      "suggested_reproduction_task": "Verify that the hustlers section shows correct first-transaction-based account ages. Cross-reference 3 addresses against public ledger data.",
      "duplicate_risk_notes": "Do NOT build a separate 'network dashboard' or 'contributor tracker'. This is the canonical visualization layer. Extend it.",
      "evidence_standard": "data_freshness_check + cross_reference_with_ledger"
    },
    {
      "id": "ART-06",
      "asset_name": "The Hive Herald",
      "lane": "network_intelligence",
      "artifact_type": "daily_publication",
      "public_url": "https://pft.permanentupperclass.com/herald/",
      "status": "live",
      "maintainer_category": "community_contributor",
      "reuse_instructions": "Daily automated export via cron. Source data from chain-index.db (SQLite). Sections: Pulse, Flow, Airdrops, Watch, Movers, Deep Cut. JSON export at pft-validator/lens/herald.json. Herald v2 snapshot format in development.",
      "suggested_reproduction_task": "Verify one day's Herald data against raw public ledger queries. Confirm memo counts, airdrop totals, and contributor activity match.",
      "duplicate_risk_notes": "Do NOT build a separate 'daily network report' or 'chain newsletter'. This is the canonical daily intelligence product. Contribute sections or verify data instead.",
      "evidence_standard": "data_accuracy_verification + public_ledger_crosscheck"
    },
    {
      "id": "ART-07",
      "asset_name": "SUBS Protocol",
      "lane": "subscription_infrastructure",
      "artifact_type": "bot_and_marketplace",
      "public_url": "https://pft.permanentupperclass.com/subs/",
      "status": "live",
      "maintainer_category": "community_contributor",
      "reuse_instructions": "On-chain subscription detection via amount-matching (keystone-encrypted memos). 2.5% protocol fee. Bot monitors XRPL for matching payments. Registry at pft-validator/lens/subs.json. To add a new subscription tier: update the SUBS bot payment detection logic.",
      "suggested_reproduction_task": "Verify that the SUBS page shows correct subscriber counts. Cross-reference 2 subscriptions against public ledger transaction data.",
      "duplicate_risk_notes": "Do NOT build a separate 'payment subscription' system. This is the canonical on-chain subscription primitive. Extend tiers or access controls instead.",
      "evidence_standard": "subscriber_count_verification + transaction_crosscheck"
    },
    {
      "id": "ART-08",
      "asset_name": "Retail Explainer Pack",
      "lane": "growth_content",
      "artifact_type": "content_artifact",
      "public_url": "https://github.com/P-U-C/pft-validator/tree/main/alpha/retail-explainer",
      "status": "shipped",
      "maintainer_category": "community_contributor",
      "reuse_instructions": "Human-first explainer with three contribution tiers, mental model section, jargon translation table, 10 social posts, 20 reply-ready community lines, PFT vs XRP comparison. Reuse social posts directly. Adapt mental models for different audiences.",
      "suggested_reproduction_task": "Take 3 social posts from the pack, post them in a crypto community, and report engagement/questions received. Document which framing resonated.",
      "duplicate_risk_notes": "Do NOT write a new 'what is Post Fiat' explainer from scratch. Use this as the base and adapt for specific audiences (developers, traders, researchers).",
      "evidence_standard": "content_review + audience_adaptation_notes"
    },
    {
      "id": "ART-09",
      "asset_name": "Adoption Metrics Snapshot",
      "lane": "network_analytics",
      "artifact_type": "metrics_snapshot",
      "public_url": "https://github.com/P-U-C/pft-validator/tree/main/alpha/adoption-metrics",
      "status": "shipped",
      "maintainer_category": "community_contributor",
      "reuse_instructions": "Weekly-updatable template with JSON sidecar. Sources: explorer.testnet.postfiat.org (validators), postfiatorg GitHub (repos), public ledger (contributors/transactions). Includes adoption funnel, contamination register, confidence tiers.",
      "suggested_reproduction_task": "Update the snapshot with current week's data. Verify validator count against live explorer. Note any metrics that have changed significantly.",
      "duplicate_risk_notes": "Do NOT create a new 'network health dashboard' or 'weekly report' without checking this exists. Update this snapshot rather than creating parallel metrics.",
      "evidence_standard": "source_url_per_metric + json_sidecar_validation"
    },
    {
      "id": "ART-10",
      "asset_name": "Awesome Post Fiat",
      "lane": "community_reference",
      "artifact_type": "curated_index",
      "public_url": "https://github.com/P-U-C/awesome-postfiat",
      "status": "live",
      "maintainer_category": "community_contributor",
      "reuse_instructions": "Community-maintained reference repo. Add projects to community/projects.md. Update weekly metrics in metrics/. Contribute resources to resources/. All PRs welcome. See CONTRIBUTING.md for rules.",